DOC_ID,TITLE,INGRESS,CUSTOM_CAT_1,CUSTOM_CAT_2,CUSTOM_CAT_3,CUSTOM_CAT_4,CUSTOM_CAT_5,CUSTOM_AUTHOR,CUSTOM_ILLUSTRATOR,CUSTOM_TRANSLATION,CUSTOM_PUBLISHING_HOUSE,CUSTOM_YEAR,CUSTOM_ISBN,CUSTOM_PAGES,CUSTOM_SUPPORTS_LSB,CUSTOM_BLA_I_BOKA,CUSTOM_BOKKILDEN,CUSTOM_INGRESS,STATUS
841,Bebe 4: Alt kjekt kan skje,Bebe og Sara er på sydentur.  No skal alt snu!,2,,11,23,25,Bente Bratlund,NULL,NULL,Mangschou,2014,9788282380829,53,1,NULL,NULL,"Eg kjenner meg så glad. Så lett.  - Torsten likar deg, seier ho så.  Eg stivnar.  - Det er berre sommarflørt, seier eg.  - Ja, du har Tommy.  - Ja, eg har Tommy.",1
842,Alle har en bakside,Alle har en forside.  Alle har en bakside.,"1,2,3",4,13.11,16,26,Anna Fiske,Anna Fiske,NULL,Cappelen Damm,2014,9788202434977,88,1,http://www.cappelendamm.no/main/Katalog.aspx?artid=9938,NULL,Alle mennesker har en kropp.  Alle kropper er forskjellige.,1
843,Så godt! med symboler og bilder,Dette er en lettlest kokebok   med bilder og symboler. ,"1,2,3",4,13,20,26,Anne Gro Innstrand og Sølvi Linde,Pål Hoff,Lene Hansen og Heidi Trolldalen ,Signo,2014,9788230325407,207,1,NULL,NULL,NULL,1
844,12 uker til et sunnere liv og en slankere midje,Denne boka gir deg en innføring i hvordan du kan endre livsstilen din på 12 uker. ,3,4,13,20,26,Berit Nordstrand,Studio Dreyer Hensley,NULL,Gyldendal,2014,9788205458390,288,NULL,http://issuu.com/gyldendalnorskforlag/docs/12_uker_til_et_sunnere_liv_og_en_sm/11?e=0/7440700,http://www.bokkilden.no/SamboWeb/produkt.do?produktId=9641365&rom=MP,"Naturen har virkelig skjønt det - den har plassert all verdens nyttige næringsstoffer, som virker sammen og forsterker hverandre, i én og samme plante. Grønnsaker, frukt og bær bidrar med både antioksidantkraft, fiber, fettsyrer, protein, langsomme karbohydrater og en hærskare nyttige vitaminarbeidere og mineralverktøy.",1
845,Mormor farmor - Håndbok for besteforeldre ,"En bok om lek og alvor, prøving og feiling.",3,4,33.32,23.17,26,Toppen Bech,Eivind Stoud Platou,NULL,Kagge,2013,9788248913719,183,NULL,http://issuu.com/kaggeforlag/docs/01_mormor_farmor/1,http://www.bokkilden.no/SamboWeb/produkt.do?produktId=9221762&rom=MP,"Jeg hadde en drøm om å bli supermormor. En verdig formidler av myten om bæssmorfanget. Jeg hadde en drøm om å bli husket for verdens beste boller, for rampete, blodtørstige eventyr og heltekvad, for sprell og sprang og fantastiske reiser og opplevelser i virkeligheten og i fantasien.",1
846,Malstrøm,"En roman fra havets dyp og himmelens høyder,   fra sorgens bunn og gledens topp.   Og om hvor raskt det skifter fra det ene til det andre.",2,,11,"14,18,23",26,Caterina Cattaneo,NULL,NULL,Gyldendal,2014,9788205457447,236,NULL,NULL,http://www.bokkilden.no/SamboWeb/produkt.do?produktId=9624356&rom=MP,"Sola kommer inn vinduet over senga, deler veggen i tykke striper. Hun stryker ham over ryggen. Huden hans er myk. Hun stryker til hun kjenner noe hardt under fingertuppene, reiser seg på albuen. Han har et stort arr på høyre side som strekker seg over ryggraden. Det er rødt og ser ikke veldig gammelt ut. ",1
847,Klatrehåndboken,En grunnleggende bok om klatring. ,3.2,4,13,21.22,26,Nils Ragnar Gustavsson,"Nils Ragnar Gustavsson, Martin Karlsson, Panda Ekvall",Ann Høydalsnes,Gyldendal,2013,9788205453241,315,NULL,http://issuu.com/gyldendalnorskforlag/docs/klatrehaandboken?e=1324688/4347404,http://www.bokkilden.no/SamboWeb/produkt.do?produktId=9346000&rom=MP,Klatring på topptau er antakelig den formen for klatring som de fleste nybegynnere kommer i kontakt med. Med topptau kan du utfordre deg selv på krevende ruter uten å måtte bekymre deg for å falle. Topptauing er også utmerket for å trene bevegelsesteknikk eller ganske enkelt bare for å ha det gøy i fjellveggen!,1
848,Motorisk trening – øvelser for barn,En introduksjon i motoriske ferdigheter for barn. ,3,4,13,21,26,Joanne Elphinston,Håkan Flank,Språkverkstaden,Akilles,2013,9879186323165,56,NULL,NULL,NULL,"Øvelsene som presenteres, er morsomme og lystbetonte – men hver og en av dem har også et bestemt formål. Det handler om å styrke bestemte deler – ""frø""– som til sammen utgjør grunnlaget for alle framtidige, effektive bevegelsesmønster. Hvis disse ""bevegelsesfrøene"", som stabilitet, balanse og kroppskontroll, plantes tidlig, får ikke barna bare god bevegelighet, men de forberedes også på innlæring av mer idrettspesifikke teknikker.",1
849,Alt om Champions League 2013,"Høydepunkter fra Champions League 2013, og morsomme fakta fra tidligere år.",1.2,4,33,21,26,Steffen Gronemann,"Scanpix, All Over, Getty",Jan Chr. Næss,Gyldendal,2013,9788205444607,77,NULL,NULL,http://www.bokkilden.no/SamboWeb/produkt.do?produktId=8007826&rom=MP,"Da Manchester United møtter Bayern Munchen i 1999 var tre nordmenn involvert, selv om bare to av dem spilte. Ronny Johnsen var med fra start, som erstatning for en skadet Henning Berg, og han spilte hele kampen. Ole Gunnar Solskjær, derimot, fikk bare 13 minutter på banen, men det var mer enn nok til å gjøre ham til den første norske matchvinneren i Champions Leagues historie.  ",1
850,Til skogs,Kjenner du skogen kalle?   Vil du vite mer om hva skogen har betydd og hva den faktisk betyr?,3,4,33.13,17.22,26,Haakon Bull-Hansen,Haakon Bull-Hansen,NULL,Kagge,2013,9788248913443,190,NULL,http://issuu.com/kaggeforlag/docs/01_til_skogs_3be1a99d013508/1,http://www.bokkilden.no/SamboWeb/produkt.do?produktId=8911840&rom=MP,"Skogens historie handler ikke bare om vekstsoner og klimaperioder, teknologi og tømmerpriser, men om menneskenes liv og virksomhet. Sporene etter våre forfedre kan leses i landskapet. Her er funn etter jegerne som vandret opp i dalen etter istiden, og av jernalderens bygdeborger og gravhauger. Her er infrastruktur og spor etter skipsbygging, jernverk, sagbruk, og en senmiddelaldersk havn for eksport av bjelker fra Larvik.",1
851,Si at vi har hele dagen ,"En historie om identitet og søken, om sorg og kjærlighet.   Om hvordan det er å være adoptert   og lure på hvordan livet ville blitt,   hvis man ikke var det.",3.2,,11,23,26,Anne Kyong-Sook Øfsti,NULL,NULL,Gyldendal,2014,9788205463646,223,NULL,NULL,http://www.bokkilden.no/SamboWeb/produkt.do?produktId=9624387&rom=MP,"Da jeg går inn i t-banevognen, forsvinner jeg, ansiktet mitt blir tatt opp i mengden. Jeg blir oppslukt. En ny og annerledes følelse av tilhørighet brer seg i kroppen min. Jeg ligner de andre, de ligner meg. En estetisk lengsel jeg ikke visste om, åpenbarer seg; jeg snur meg og ser bakover, ikke ett eneste hvitt ansikt, ikke én skarp linje i synsfeltet, bare et bølgende teppe i sort og brunt.",1
852,Livets skole,Noen afghanske kvinner risikerer sitt eget liv for å redde andres.   Dette er historien om jordmorskolen i Wardak.  ,3.2,,33.32,23.17,26,Kristin Solberg,NULL,NULL,Aschehoug,2013,9788203293412,305,NULL,http://issuu.com/aschehoug/docs/kristin_solberg_-_livets_skole?e=2026704/5148927,http://www.bokkilden.no/SamboWeb/produkt.do?produktId=9366603&rom=MP,"Sommeren 2011, da jeg begynte arbeidet med denne boken, døde hvert femte afghanske barn før det fylte fem år, det vil si 550 barn hver eneste dag. Samtidig døde en afghansk kvinne i barsel hver halvtime. Det ble sagt at det var 200 ganger mer sannsynlig at en afghansk kvinne døde i barsel eller av graviditetskomplikasjoner, enn av kuler og bomber. ",1
853,Fellesskap fungerer – om velferdsordningene ,Stemmer det at Norges velferdsordning gjør oss passive?,3,4,13,17,26,Lotta Elstad,NULL,NULL,Manifest ,2013,9788292866689,110,NULL,NULL,http://www.manifest.no/elstad-fellesskap_fungerer,"Ordningene er til for at mennesker ikke skal ruineres om de ikke kan sikre seg selv økonomisk gjennom jobb eller annet. Dersom man sikter mot at ""noen av ytelsene vi har, bør begrenses"", noe som innebærer ""kutt i utbetalingene for noen"", vil maktforholdene forskyves til fordel for dem som allerede har mer. Det er heller ikke utenkelig at fattigdommen i Norge vil øke.",2
854,Fellesskap fungerer – om arbeidslivet,I denne boka kan du lese noen av grunnene til hvorfor det går bra med Norge.,3,4,13,17,26,"Ida Søraunet Wangberg, Ingrid Wergeland, Lotta Elstad ",NULL,NULL,Manifest ,2014,9788292866795,78,NULL,NULL,http://www.bokkilden.no/SamboWeb/produkt.do?produktId=9998841&rom=MP,"Lenge har det vært en trend at industribedrifter har flyttet produksjonen sin til land med lavere lønninger for å øke lønnsomheten. Nå ser vi flere tilfeller av norske industribedrifter som flytter tilbake igjen. Et eksempel på dette er Brumunddals-bedriften Globus, som lager deler til landbruksmaskiner. Bedriften har flagget hjem fra Litauen. ",2
855,Beskytteren,"En ekte high school-roman fra New Jersey, USA. ",2,,11,14,26,Harlan Coben,NULL,Chris Hafstad,Aschehoug,2013,9788203255946,272,NULL,NULL,http://www.bokkilden.no/SamboWeb/produkt.do?produktId=9333057&rom=MP,"Jeg presset ryggen inn mot husveggen slik at jeg ikke var synlig. Hjertet begynte å dunke hardt i brystkassen. Jeg la fra meg ballen og gled langsomt mot høyre, nær garasjen. Jeg holdt hodet lavt og kikket rundt hjørnet mot gaten foran huset til Myron. Og der, parkert på hjørnet kanskje et par hundre meter fra huset, sto en svart bil med sotede vinduer. Det så ut til å være den samme bilen jeg hadde sett på basketbanen tidligere på dagen, den samme bilen jeg hadde sett utenfor huset til Bat Lady.",1
856,Brune,Runes bestefar er død.  De slemme guttene river trehytta hans.  Men Rune har en hemmelighet.  ,1.2,4,11,"15,16,23",26,Håkon Øverås,Øyvind Torseter,NULL,Gyldendal,2013,9788205436367,135,NULL,NULL,NULL,"- Har du lest Bibelen? spurte Blåse.  - Jeg har hørt rykter om den, sa Svartle. - Jeg må være med mora mi på sånne møter der de snakker om at folk i Bibelen ser syner og tryller helt fantastiske ting før de dør og kommer til paradis. Jeg tror de overdrive",2
857,Olene i den nye genseren,Artig bok om å være anderledes.,1.2,4,11,16.23,26,Oliver Jeffers,Oliver Jeffers,Henning Hagerup,Gyldendal,2013,9788205432130,32,NULL,NULL,NULL,"Saken med olene var at alle var helt like.  Det var mange, mange av dem  og alle så helt like ut...  ...inntill den dagen en av dem  -Rupert var navnet hans-  strikket en ny fin genser.",2
858,Dette er ikke min hatt,En liten fisk stjeler en hatt.,1,4,11,15,26,Jon Klassen,Jon Klassen,Margrete Rasmussen,Mangschou,2013,9788282380713,32,NULL,NULL,NULL,Dette er ikke min hatt.  Jeg har akkurat stjålet den.  Jeg stjal den fra en stor fisk.  Han sov da jeg gjorde det.,2
859,Spisetid,Fantasifull bok om å spise opp maten sin.,1,4,11,23.2,26,Rebecca Cobb,Rebecca Cobb,Anne Horn,Omnipax,2013,9788253036243,32,NULL,NULL,NULL,"Det var spisetid, og mamma sa:   ""Spis opp maten din!""  ""Nei takk,"" sa jeg. ""Jeg er alfor opptatt.""  Men da ble mamma sint og sa at jeg  skulle sette meg til bords.",2
860,Uhca Pi/Knust,Poetisk bok om å ha det vondt.,1,4,11.12,23,27.26,Hege Siri,Calef Brown,NULL,Magikon,2013,9788292863510,32,NULL,NULL,NULL,Lille Pi har vondt som en fugl  som flyr inn i et vindu.,2
861,Forelska forever,Ellas mamma har fått ny kjæreste.  ,1,4,11,23.18,26,Unni Lindell,Lars Rudebjer,NULL,Aschehoug,2013,9788203255472,56,NULL,NULL,NULL,"Ella kjente at hun frøs. Hun dro vinduet igjen og trakk gardinene for.  Hun likte ikke at Christina hadde sagt det om å kysse.  ""Bendik er veldig kjekk,"" Sa Christina og så på Ella med de pene, brune øynene sine.  ""Jeg har sett ham i friminuttene.""   ""Nå skal vi sove,"" sa Ella surt.    ",2
862,Fakirer,Alt om fakirer!,1,4,33,24,26,Bengt Erik Engholm,Jojo Falk,NULL,Omnipax,2013,9788253036120,45,NULL,NULL,NULL,Fakirer får til ting som vanlige folk besvimer av.  Bare hør her:  Fakiren Haridas lot seg begrave i førti dager.  Dette var på 1800-tallet i India.,2
863,Mumier,Alt om mumier!,1,4,33,17,26,Malin Lilja,Jojo Falk,Gøran Karlsvik,Omnipax,2013,9788253036113,45,NULL,NULL,NULL,"Når et menneske dør,  råtner kroppen ganske fort.  Alt som blir igjen er en haug med bein.  En mumie er en død kropp som er behandlet slik at den ikke råtner.  Det kalles balsamering.  Mumiene kan fortelle mye spennende for oss som lever i dag.",2
864,Redd,Det er best å være sammen når man er redd.,1,4,11,16.23,26,"Kaia, Bendik og Trond Brænne",Per Dybvig,NULL,Aschehoug,2013,9788203256271,32,NULL,NULL,NULL,NULL,2
865,Hva sier reven?,"Ja, hva sier egentlig reven?",1,4,12,16,26,Ylvis,Svein Nyhus,NULL,Aschehoug,2013,9788203256813,32,NULL,NULL,NULL,"Men når alt er mørkt og stille  og menneskene går hjem  og ingen lenger maser,  da kommer reven frem.    Og sier...",2
866,Buster,Hva gjør en katt om natten?,1,4,11,24,26,Lars Saabye Christensen,Bo Gaustad,NULL,Aschehoug,2013,9788203255984,32,NULL,NULL,NULL,Jeg sniker meg ut.    Ingen vet hvor jeg går om natten.  Det er det bare jeg som vet.  Men jeg kan si det nå.,2
867,Nysgjerrig på... Bakterier,Hva er egentlig bakterier?,1.2,4,13,22,26,Bjørn Arild Ersland,Espen Fridberg,NULL,Mangschou,2013,9788282380683,100,NULL,NULL,NULL,Det yrer av liv i magen din.  Faktisk har du mer enn to kilo bakterier inni deg.  Levende organismer som bor i og på kroppen.  De er så mange at ingen har klart å telle dem.,2
868,Natt på skolen,En klasse får en glup ide!,1,4,11,23,26,Helena Bross,Christel Rönns,Lise Mänikö,Cappelen Damm,2011,9878202337612,61,NULL,NULL,NULL,-Jeg vil ha gym hele tiden! sier Live  -Kanskje dere vil bo i gymsalen? spøker Robert.  -Ja! sier Siri. Vi kan sove på mattene!,2
869,Denne elgen er min,Kan man eie en elg?,1,4,,23.16,26,Oliver Jeffers,Oliver Jeffers,Henning Hagerup,Gyldendal,2014,9788205458741,32,NULL,NULL,NULL,"Wilfred eide en elg.  Han hadde ikke alltid eid en elg. Elgen kom til ham for en stund siden,  og han bare VISSTE   at den skulle være hans.",2
870,Hvis du lyver,Klara er forelsket i den to år eldre Sofie.,2.1,,11,18.23,26,Thomas Marco Blatt,NULL,NULL,Cappelen Damm,2014,9788202429850,144,NULL,NULL,NULL,"Sofie stryker fingrene over Klaras hånd.  Klara gløtter bort på Sofie og moren,  de ser rett fram,  ansiktene er svakt opplyst av kinolerretet.  Klara legger cardiganen forsiktig over armlenet,  fletter hånda si inn i Sofies...",2
871,Så vakker du er,Poetisk bok om kjærleik og død.,2,,11,18.23,25,Brynjulf Jung Tjønn,NULL,NULL,Cappelen Damm,2013,9788202415952,128,NULL,NULL,NULL,NULL,2
872,Lyset om kvelden,Om å få tilbake lyset i gatelykt og menneske.,1,4,11,23,26,Gaute Heivoll,Marvin Halleraker,NULL,Cappelen Damm,2014,9788202429065,40,NULL,NULL,NULL,"Det står en lyktestolpe utenfor vinduet til Tom.  Hver kveld blir lyset tent,  og hver morgen blir lyset borte.  Slik har det vært så lenge Tom kan huske.    -God natt, sier Tom ut av vinduet før han legger seg.  -Sov godt, svarer lyset.",2
873,Zainab må flykte,22 milioner flyktninger i verden er barn.,1.2,4,11.33,23,26,Salah Nassar,Salah Nassar,NULL,Omnipax,2013,9788253035925,40,NULL,NULL,NULL,"Denne skal du ha, vennen min, sier bestemor,  og rekker meg en blå stein, med et hvitt øye.  Det ligner på en hånd.  ""Det er en ""el zerge"", den vil bringe deg hell og lykke  og beskytte deg mot alt ondt.""",2
874,Dagene før mai,Mørkt og morsomt om sorg.,2,,11,"18,23,16",26,Sanne Mathiassen,NULL,NULL,Cappelen Damm,2012,9788202370367,184,NULL,NULL,NULL,"En morgen kaller jeg mamma så stygge ting at hun begynner å gråte.  Jeg er så sint at jeg ikke klarer å trøste henne,  og resten av ettermiddagen har jeg fryktelig vondt i magen.",2
875,Bare en time til,Ung jente kjemper mot mørket med lommelykt.,2,,11,"16,18,23",26,Sanne Mathiassen,NULL,NULL,Cappelen Damm,2014,9788202420611,96,NULL,NULL,NULL,"Midt i romjula har jeg bursdag.  Vi feirer litt nede ved fryseren, du og jeg.  Du var alltid så flink til å huske bursdagene mine.  Pappa har glemt å kjøpe gave nå også.   Han sier det er øl i kjøleskapet.  ""Bare ta,"" sier han.  ""Nå er du vel gammel nok,"" sier han.  Det er et år til jeg er gammel nok og pappa burde vite det.  Det står med store bokstaver i kalenderen du har hengt på kjøleskapet.  Det er likevel bortkastet å ha bursdag i jula.   Da spiser man jo kake uansett.  ""Du skulle egentlig kommet etter nyttår,"" fortalte du meg.  ""Men du har jo alltid vært så himla utålmodig,"" sa du.  Jeg drikker en øl likevel.   Det smaker ikke noe godt.  Jeg og pappa og hver vår øl til Dagsrevyen.  Adolf Hitler var avholdsmann,  og ingen vil vel være som han.   ",2
876,Oldefars ulveskinnspels,Hvordan jobbet en lege i gamle dager?,1,4,11,17.23,26,Adele Lærum Duus,Elisabeth Moseng,NULL,Mangschou,2012,9788282380539,34,NULL,NULL,NULL,"Når oldefar skulle ut i sykebesøk,  kjørte han med hest og kjerre,  eller med slede hvis det var vinter.  Det hendte han måtte ro,  andre ganger tok han toget.  Der man ikke kunne komme frem på annen måte,  gikk han til fots eller på ski.  En gang måtte han klatre i stiger oppover et stup  for å komme frem til en fjellgård.  Der hjalp han til med en barnefødsel.  Dagen etter heiste bonden ham ned igjen med et tau.",2
877,Kakerlakken med den stygge frakken og hovudet fullt av triste tankar,"Når sola forsvinn, er det lett å bli trist.",1,4,11,15.23,25,Martine Grande,Martine Grande,NULL,Samlaget,2013,9788252183405,36,NULL,NULL,NULL,"Når hausten kjem,  sloknar sola,  både på himmelen  og inne i kakerlakken.    Tomheita kjem smygande som ein listig tjuv.  Den stel glede.  Den stel farge.    Kakerlakken blir redd.  Redd for å blø.  Redd for å dø.   Vinteren tek ofte knekken på småkryp.",2
879,Superhelt søkes- og andre spenningshistorier,Veldig korte historier med rar slutt!,1,4,11,15.16,26,Ulli Schubert,Iris Hardt,Ute Neumann,Cappelen Damm,2011,9788202336653,59,NULL,NULL,NULL,"Leo finner et oppslag på et tre.  Der står det:   ""Superhelt søkes! Ta kontakt.""  Da blir han nysgjerrig.  Leo tar lappen og går for å finne adressen.",2
880,De stjålne barna,Lettlest og spennende fantasy.,1.2,4,11,15,26,Jo Salmson,Natalia Batista,Kjersti Scheen,Cappelen Damm,2012,9788202388898,128,NULL,NULL,NULL,"- Hvis hun sier nei, så drar jeg uansett,  hun kan ikke hindre meg.  Hun får bare finne en annen til å skure gulv for henne.  Begge guttene stirret på henne.   Hun så hvor forskrekket de var.  - Men... sa Eno. - Du skjønner vel.  - Det går ikke, sa Arel n",2
881,Timmy Tabbe - det ble begått feil,Veldig morsom bok om verdens dårligste detektiv!,1.2,4,11,16,26,Stephan Pastis,Stephan Pastis,Stian Omland,Gyldendal,2013,9788205457515,294,NULL,NULL,NULL,"Noe er galt med skolesystemet vårt.  Jeg sier det fordi det er kjedelig.  Hadde lærerne virkelig villet at vi skulle lære,  ville skoledagen inneholdt småting som ville gjort det interessant å lære.  For eksempel å sette Rollo Tookus og en okse i et lukket rom.  Det ville lært meg at man aldri skal leke med okser.    ",2
882,Mens vi venter på nissen,Lag din egen julepynt!,"1,2,3",4,32,19.24,26,Anna Fiske,Anna Fiske,NULL,Aschehoug,2013,9788203255991,152,NULL,NULL,NULL,"Hva skal jeg finne på mens jeg venter?  Ja, jeg kan lage juleting!",2
883,Bursdagsmysteriet,Klassisk krim!,1,4,11,14,26,Martin Widmark,Helena Willis,Tor Fretheim,Cappelen Damm,2013,9788202400354,90,NULL,NULL,NULL,Barbro bøyer seg ned for å rette opp stolen som har falt over.  Da blir Mohammed plutselig helt blek.  Han peker på henne med en skjelvende finger.  - Barbro! Stå stille! Det har skjedd noe forferdelig!  - Ha... ha... hals... kjedet ditt! stammer Mohammed.,2
884,Nordmarka - natur og miljø,Boka for den som ønsker å bli skikkelig godt kjent med Nordmarka. ,3,4,13,22,26,Leif Ryvarden,NULL,NULL,Dreyers,2013,9788282650670,213,NULL,NULL,http://www.bokkilden.no/SamboWeb/produkt.do?produktId=8348069&rom=MP,"Mange mener at kontakt med levende natur er nødvendig for sjelelig sunnhet, og alle har vi i Marka hatt store naturopplevelser. Vinterstid kan det være stillheten blant kritthvite, snøtune graner, eller en vårkveld med måltrostens klare fløytetoner, suset i trekronene og lukten av råtnende snø som driver mellom trestammene. Tallrike studier har vist at kontakt med naturen reduserer stress og fremmer rehabilitering etter den psykiske utmatting mange kjenner etter et hektisk liv i et myldrende bymiljø. ",2
885,Et liv i stein,Eventyret om steinkongen Thor Lundh; visjonæren som så mulighetene.,3,4,13.33,22.24,26,Tom Lotherington,NULL,NULL,Aschehoug,2012,9788203390531,160,NULL,NULL,http://www.bokkilden.no/SamboWeb/produkt.do?produktId=7652337&rom=MP,"Det begynte med et stort smell. Fjellet åpnet seg – og der lyste det av skatten i det blå berget. Da kruttrøyken og støvet hadde lagt seg, så de det: Bruddsidene skinte i blått. Den enorme kubben de hadde sprengt løs, hadde styrtet nesten ti meter ned langs den bratte fjellsiden, ned myra så torv og myrvann sto til værs.",2
886,Bombene over Hiroshima og Nagasaki,Dette er historien om hva som skjedde nede på bakken da bombene smalt.  ,3,4,33,17,26,Anne Thelle,NULL,NULL,Omnipax,2013,9788253036175,128,NULL,NULL,http://www.bokkilden.no/SamboWeb/produkt.do?produktId=8324331&rom=MP,"Yoshiharu Yasuhara var 17 år da bomben falt. Tidlig på morgenen dagen etter var han på vei hjem da han fikk øye på en kvinne som lå midt i veien. I armene holdt hun et lite barn, og hun hadde krøket seg over barnet som for å beskytte det, men til ingen nyte. Begge var brent svarte. Yoshiharu tenkte med en gang at det kunne være sin egen mor og lillesøster han så, men i stedet for å se nærmere etter, styrtet han avgårde til hjemmet bare noen titalls meter unna.  ",2
887,Nynorsk for dumskallar,"Ei innføring i nynorsk for dei som ikkje vil læra det. Og for alle andre, sjølvsagt.",2.3,,13,24,25,Kristin Fridtun,NULL,NULL,Samlaget,2013,9788252183160,108,NULL,NULL,http://www.bokkilden.no/SamboWeb/produkt.do?produktId=8322955&rom=MP,"Eit godt råd er å dela opp det du skal læra, og konsentrera deg om éin del om gongen. Du kan til dømes setja av litt tid til å berre arbeida med nynorske hokjønnsord. Ikkje gjev deg før du har halde på ei stund. Stoffet blir meir overkomeleg når du deler det opp i bitar i staden for å fortvila over at du ikkje forstår alt med ein gong. Tenk at det er som å eta ei brødskive: Vi tek éin bit og tygg han godt før vi tek ein ny bit; vi stappar ikkje inn heile skiva og svelgjer henne heil.",2
888,Bursdagskaker,Avanserte festkaker for store og små.,3,4,13,20,26,Janne Jensen,Veslemøy Vråskar,NULL,Cappelen Damm,2013,9788202397180,110,NULL,http://issuu.com/cappelendamm/docs/bursdagskaker?e=0,http://www.bokkilden.no/SamboWeb/produkt.do?produktId=8070863&rom=MP,"Min store hobby og lidenskap er baking og kakepynting. En av grunnene til at jeg elsker dette, er at mulighetene er så mange, og det er vel egentlig bare fantasien som setter begrensninger. Jeg får lov til å være kreativ, og derfor er det så gøy. Det hjelper imidlertid ikke å imponere med kaker som ser flotte ut hvis de ikke smaker godt. Hva som befinner seg under pynten på den flotte kaken er like viktig.  ",2
889,Burgerboka,Har du burger på hjernen?,3,4,13,20,26,Terje Haakstad og Panos Konstantinidis,Raymond Mosken,NULL,Kontur,2013,9788293053200,159,NULL,NULL,http://www.bokkilden.no/SamboWeb/produkt.do?produktId=9362861&rom=MP,"Selv synes vi at de store kjedene har gitt burgeren et ufortjent dårlig rykte som usunn kaloribombe og forutsigbar, kjedelig mat, forbeholdt simple smaksløker. Likevel er det et ubestridelig faktum at en overlegent stor majoritet av alle burgere som blir solgt og fortært verden over, kommer fra disse gigantselskapene. Det er synd, for vi mener det er åpenbart at de beste burgerne ikke er de som masseproduseres og tilberedes av svette og underbetalte tenåringer uten den minste interesse for matlaging, slik tilfellet er litt for ofte i disse kjedene. ",2
890,5:2-diettens kokebok,"En enkel innføring i hvordan du to dager i uka faster mellom frokost og middag, og hva du helst bør spise når du først spiser.",3,4,13,20,26,Mimi Spencer og Sarah Schenker,Tomas Ford,Lisbeth Kristoffersen,Gyldendal,2014,9788205461826,223,NULL,http://issuu.com/gyldendalnorskforlag/docs/5-2-diettens_kokebok?e=1324688/6405509,http://www.bokkilden.no/SamboWeb/produkt.do?produktId=9641374&rom=MP,"Reglene for hva du kan spise, er ikke så mange. Du trenger ikke måle opp fyrstikkeskestore porsjoner med ost. Du trenger verken å veie maten, ergre deg eller løse kompliserte regnestykker. Mottoet for måltidene de dagene du faster, er ""først og fremst proteiner og matvarer fra planteriket."" Dette er basisen for alle oppskriftene i boken. De inneholder også litt fett, noen langsomme karbohydrater og et og annet meieriprodukt. ",2
891,Betroelser,"Dikt om kjærlighet, familie, sykdom; om lidelse og håp.  ",3,,12,18.23,26,Hanne Langeland Brune,NULL,NULL,Lyst,2014,9788293349037,78,NULL,NULL,http://www.bokkilden.no/SamboWeb/produkt.do?produktId=10046738&rom=MP,Forlatt    Hele tiden har jeg fryktet det  å bli forlatt.    Har opplevd det mange ganger  i fantasien.    Men barna mine forlater meg aldri.    Selv om de er et annet sted bor de i hjertet mitt  og jeg bor i hjertene deres.    Derfor er vi sammen.  ,2
892,Bildilla,En hyllest til alle som har bildilla!,3,4,13.33,24,26,Eskil Roll og Gunn M. Roll,Eskil Roll,NULL,Kagge,2013,9788248913375,156,NULL,NULL,http://www.bokkilden.no/SamboWeb/produkt.do?produktId=9249996&rom=MP,"Jeg har fått bilen gratis, og planen er å få den på veien uten å bruke ei krone på den. Men akkurat nå er det den her som er babyen da, sier Stig og peker på en gammel motorsykkel han har stående.  – Det er en 1954 Simson AWO. De ble bygd på øst-tyske BMW-fabrikker på 50-tallet og importert og solgt i Trondheim. Bensintanken på sykkelen har jeg malt for hånd med pensel og 3-stjerners gulvlakk.    ",2
