DOC_ID,TITLE,INGRESS,CUSTOM_CAT_1,CUSTOM_CAT_2,CUSTOM_CAT_3,CUSTOM_CAT_4,CUSTOM_CAT_5,CUSTOM_AUTHOR,CUSTOM_ILLUSTRATOR,CUSTOM_TRANSLATION,CUSTOM_PUBLISHING_HOUSE,CUSTOM_YEAR,CUSTOM_ISBN,CUSTOM_PAGES,CUSTOM_SUPPORTS_LSB,CUSTOM_BLA_I_BOKA,CUSTOM_BOKKILDEN,CUSTOM_INGRESS,STATUS
893,Fotballmagi,Vil du utvikle deg som fotballspiller?,2.1,4,13,21,26,Viggo Strømme,NULL,NULL,Kagge,2013,9788248913399,111,NULL,http://issuu.com/kaggeforlag/docs/01_fotballmagi/1,http://www.bokkilden.no/SamboWeb/produkt.do?produktId=8322952&rom=MP,At fotball er et dynamisk spill vil si at det hele tiden er mange bevegelser og nye situasjoner som oppstår. Det betyr også at det hele tiden er omstillinger fra forsvar til angrep og motsatt. Spillet kan ofte bølge fram og tilbake. Fotball er spill og motspill.    Det er ikke alltid noen av lagene kommer seg i etablert forsvar. Det å oppfatte situasjonene hurtig ved balltap og ballerobring er veldig viktig. Dette for å kunne angripe det andre laget som eventuelt er i ubalanse og for å kunne komme i balanse for det forsvarende laget.  ,2
894,Med helsing frå Sogn og Fjordane   ,"Om du ikkje fekk tida til å reise til Sogn og Fjordane i sumar, kan du berre skaffe deg den her boka.  ",3,4,33,22,25,Henning Rivedal,Leiv Bergum,NULL,Skald,2013,9788279591955,205,NULL,NULL,http://www.bokkilden.no/SamboWeb/produkt.do?produktId=9415282&rom=MP,"Kor kaldt skulle det vore her  om ikkje fjorden var?  Om Golfstraumen ikkje sende varme  straumar like inn i Jotunheimen?    På høgd med Jakutsk på den sibirske tundraen  nord i Hudson Bay  midt i Alaska  nord for Kapp Farvel på Grønland    Her veks eple, plommer, pærer og morellar  saman med fersken og valneter  I eit voksterland mellom fjord og fjell  der evig snø kysser lyset i sommarnatta  ",2
895,God jul,For noen handler jul om gaver. For andre handler det om mye mer. I denne boka er det litt av alt.  ,3,4,13,19,26,May B. Langhelle og Heidi Bjørnsdotter Thorvik,May B. Langhelle,NULL,Gyldendal,2013,9788205449947,215,NULL,http://issuu.com/gyldendalnorskforlag/docs/godjul?e=1324688/4883662,http://www.bokkilden.no/SamboWeb/produkt.do?produktId=8958175&rom=MP,"Er du en som samler på det mest utrolige? Slik som skakke og rustne gamle spiker? Gamle utvaskede plankebiter funnet på en strand, kongler samlet på turer i skog og mark og ståltråd du ikke helt vet hva du skal bruke til? Da kan du finne fram alt dette nå og la deg inspirere til å lage noen små juletrær på sokkel.",2
896,Helt enkelt – en basiskokebok ,"Du kan ikke å lage mat, sier du? Det kan hende du kan det litt bedre etter å ha lest denne boka.",3,4,13,20,26,Ingrid Espelid Hovig og Paul Løwe,Nina Dreyer Hensley,NULL,Gyldendal,2013,9788205461260,223,NULL,NULL,http://www.bokkilden.no/SamboWeb/produkt.do?produktId=9484189&rom=MP,"Wokkede grønnsaker er topp både når det gjelder farge og smak. Lettvint å lage er det også. Det er forarbeidet som er det viktigste. Alle grønnsakene må være vasket, renset og skåret opp på forhånd. Finn også fram alt det andre som skal brukes, som soyasaus eller balsamicoeddik, salt, pepperkvern, olje og redskaper.    Du trenger strengt tatt ikke en wok. En stor stekepanne eller vidbunnet gryte vil gjøre nytten. Men det er liksom enklere å røre rundt i matvarene i woken fordi den har så vid åpning. Bruk alle typer grønnsaker, for eksempel gulrot, løk, blomkål, brokkoli, hodekål, squash, bønner, sukkererter, bladgrønnsaker og spirer.    ",2
897,Charlottes viltkokebok,Ikke bare ei viltkokebok. ,3,4,13,22.2,26,Charlotte Mohn Gaustad  ,Mona Nordøy,NULL,Cappelen Damm,2013,9788202414115,175,NULL,http://issuu.com/cappelendamm/docs/blaibok_viltkokebok?e=0,http://www.bokkilden.no/SamboWeb/produkt.do?produktId=9280621&rom=MP,"Det er mye godt vilt! Trost, eller kramsfugl, var kjent som en delikatesse i gamle dager, men det er få som bruker det i dag. Mesteparten av trosten som blir skutt i Norge, blir skutt av italienere. De regner den fortsatt som en delikatesse. Beverjakta er spesiell og eksotisk. Idet isen går i elver og dammer, er det full aktivitet, og det er mange unge jegere som starter sesongen med beverjakt.",2
898,Papayaene i Gombolo ,Anne Louise Hübert er 19 år gammel da hun drar til landsbygda i Kenya for å møte ”det virkelige Afrika”. ,3,4,33,17,26,Anne Louise Hübert,Anne Louise Hübert,NULL,Gyldendal,2013,9788205445505,263,NULL,NULL,http://www.bokkilden.no/SamboWeb/produkt.do?produktId=8008296&rom=MP,"- Får barna på Primary mat hver dag? Rektoren svelget tung før han fortalte at myndighetene hadde hatt et skolematprogram i lengre tid, men at da skolen startet etter ferien, hadde det ikke kommet noe mat. Han viste meg et tomt matlager innenfor kontoret ",2
899,Kenneth,Dette er historia om Kenneth Sivertsen og kva suksessen gjorde med han. ,3,,33,23,25,Kathrine Sele,NULL,NULL,Samlaget,2013,9788252183184,175,NULL,http://issuu.com/detnorskesamlaget/docs/kenneth?e=1955840/5027511,http://www.bokkilden.no/SamboWeb/produkt.do?produktId=9320807&rom=MP,"No hadde det verkeleg bikka over for han – nøyaktig når, veit dei ikkje. For den vesle truppen tok det meste til å dreie seg om akkurat dette: Korleis halde Kenneth edru nok til å gjennomføre showet. Korleis passe på at han var der i tide, og ikkje ti minutt eller meir etter at det hadde begynt.",2
900,Atlanterhavsflygaren Thor Solberg - ei røvarhistorie,Den utrulege historia om ein eventyrar utanom det vanlege.,3,4,33,17,25,Dag H. Nestegard,NULL,NULL,Samlaget,2013,9788252183078,140,NULL,http://issuu.com/detnorskesamlaget/docs/atlanterhavsflygaren_thor_solberg?e=1955840/4825287,http://www.bokkilden.no/SamboWeb/produkt.do?produktId=9317497&rom=MP,"18. juli 1935 klokka 13.30 var han igjen klar til å starte. Vêret var fint. Thor tok på seg skinnhuva og stramma reima under haka. Så flybrillene og eit par varme hanskar. Fordi dei flaug i open cockpit, kunne det bli kaldt i høgare luftlag. Han sjekka at jakka sat godt, og starta motoren. Deretter gjekk det slag i slag.",2
901,Dikterjenter,"Boka om Lucy Maud Montgomery, forfatteren bak Anne fra Bjørkely.",2.3,,33,17.23,26,Lise Männikö,NULL,NULL,Omnipax,2013,9788253036144,156,NULL,NULL,http://www.bokkilden.no/SamboWeb/produkt.do?produktId=9355108&rom=MP,"Maud gjorde seg ferdig og gikk ned trappa. I det samme kom faren inn døra med posten fra dagen før. Maud kunne se at The Patriot stakk ut mellom brevene. Hun grep avisa med skjelvende fingre. Bladde. Så ble hun svimmel, bokstavene danset foran øynene hennes. Der var diktet hennes!   Hun fikk ikke fram et ord, bare viste siden til faren sin. Hun skulle aldri glemme hvor glad han så ut. Og stolt. Stemoren hennes derimot, så dødelig fornærmet ut. Akkurat som om Maud skulle ha gjort det for å plage henne.  ",2
902,Snatch,To unggutter planlegger å kidnappe en ung jente ...    Henrik og Martin har kidnappet en rik tolvåring.   De har forberedt og planlagt i flere måneder.   Det virket som en god idé. Men nå…   Nå virker det ikke så smart lenger.,2,,11,14,26,Tor Arve Røssland,NULL,NULL,Mangschou,2014,9788282381024,129,1,NULL,http://www.bokkilden.no/SamboWeb/sok.do?rom=Boker&isbn=9788282380386&rom=MP&ept=2&pid=100100,Om fem minutter vil alt endre seg.  Da er det ingen vei tilbake.  Jeg og Martin sitter i varebilen og venter.  På andre siden av gaten ligger en svær villa.  Rundt hagen er det en høy hekk.    Om fem minutter kommer hun til å gå ut døren  og ta til venstre.  Slik hun gjør hver mandag.    Vi sitter helt stille og venter.  Martin puster raskt.  Jeg hører at han er nervøs.  Pulsen min er skyhøy.  Jeg svetter på ryggen.,1
903,Venner,En varm og fin bok om vennskap.,2.3,,33,23,,Torill Heia og Britt-Evy Westergård,NULL,NULL,Universitetsforlaget,2014,9788215023533,138,1,NULL,NULL,"Min beste og eneste gutten   jeg har i livet mitt nå   er Tommy.    Tommy traff jeg første gang i 2006,  da han flyttet inn i leiligheten   som Per-Erik hadde hatt i Peckels.    Vi er naboer og han er min beste venn  for alltid.    Tommy er en kjernekar,  blid, hyggelig oe en skikkelig kjekkas.  Han har også Down syndrom.  Det liker jeg så godt.    ",1
904,Minner i bilder,Bildebok for personer med demens,3,4,33,,26,Hilde Kramer,NULL,NULL,Forlaget aldring og helse,2014,9788280612366,43,1,NULL,NULL,Mat vekker minner.  Liker du pultost og gammelost?  Hva med surmelk og lefse?  Pannekaker og blåbærsyltetøy.  Sprøstekt makrell. Sursild. Lapskaus.  Lettsprengt oksekjøtt med kål.  Fersk suppe med flatbrød.  Kjøttkaker med nyrørte tyttebær og årets poteter.  Noen bakerier lager fortsatt vørterkake. Server smakeboker!  Kjøkkenredskaper kan tas med som et utgangspunkt for samtalen.,1